{
  "$schema": "https://json-schema.org/draft/2020-12/schema",
  "$id": "https://zeroemployee.org/schemas/sovereign-agent/v1/governed-execution-request.schema.json",
  "title": "Governed Execution Request",
  "type": "object",
  "required": [
    "schema_version",
    "seat_instance_id",
    "sovereign_session_id",
    "execution_id",
    "invocation_id",
    "repository_id",
    "operation",
    "input",
    "governance",
    "capability_manifest",
    "requested_at",
    "conversation_id",
    "seat_type",
    "requested_by",
    "authority_refs",
    "work_artifact_refs",
    "base_ref",
    "branch"
  ],
  "properties": {
    "schema_version": {"const": "1.0"},
    "seat_instance_id": {"$ref": "#/$defs/id"},
    "sovereign_session_id": {"$ref": "#/$defs/id"},
    "execution_id": {"$ref": "#/$defs/id"},
    "invocation_id": {"$ref": "#/$defs/id"},
    "provider_session_id": {
      "oneOf": [{"$ref": "#/$defs/id"}, {"type": "null"}]
    },
    "worker_handle_id": {
      "oneOf": [{"$ref": "#/$defs/id"}, {"type": "null"}]
    },
    "repository_id": {"$ref": "#/$defs/id"},
    "operation": {"type": "string", "minLength": 1},
    "input": {"type": "object"},
    "governance": {"type": "object"},
    "capability_manifest": {
      "$ref": "capability-manifest.schema.json"
    },
    "requested_at": {"type": "string", "format": "date-time"},
    "conversation_id": {"type": "string", "minLength": 1},
    "seat_type": {"$ref": "#/$defs/id"},
    "requested_by": {"type": "string", "minLength": 1},
    "authority_refs": {"type": "array", "items": {"type": "string"}, "minItems": 1},
    "work_artifact_refs": {"type": "array", "items": {"type": "string"}},
    "base_ref": {"type": "string", "minLength": 1},
    "branch": {"type": "string", "minLength": 1},
    "constraints": {"type": "object"},
    "required_evidence": {"type": "array", "items": {"type": "string"}},
    "acceptance_commands": {
      "type": "array",
      "items": {"type": "array", "items": {"type": "string"}}
    },
    "predecessor_execution_id": {
      "oneOf": [{"$ref": "#/$defs/id"}, {"type": "null"}]
    }
  },
  "$defs": {
    "id": {
      "type": "string",
      "minLength": 1,
      "maxLength": 128,
      "pattern": "^[A-Za-z0-9](?:[A-Za-z0-9._:/-]{0,126}[A-Za-z0-9])?$"
    }
  },
  "additionalProperties": true
}
