{
  "schema_version": "1.0",
  "seat_instance_id": "seat-01",
  "sovereign_session_id": "session-01",
  "execution_id": "execution-01",
  "invocation_id": "invocation-01",
  "provider_session_id": null,
  "worker_handle_id": null,
  "predecessor_execution_id": null,
  "repository_id": "repo:zeroemployee/sovereign-agent",
  "operation": "run",
  "input": {
    "prompt": "check"
  },
  "governance": {
    "network": "restricted"
  },
  "capability_manifest": {
    "capabilities": {
      "network": {
        "available": false,
        "evidence_level": "enforced",
        "details": {
          "mechanism": "sandbox"
        }
      }
    }
  },
  "requested_at": "2026-08-22T12:00:00Z",
  "conversation_id": "round-1",
  "seat_type": "zeo-stream",
  "requested_by": "operator",
  "authority_refs": [
    "ruling/RULING-359.md"
  ],
  "work_artifact_refs": [],
  "base_ref": "origin/main",
  "branch": "sovereign/seat-01/execution-01",
  "constraints": {
    "trunk_mutation": "forbidden",
    "self_merge": "forbidden",
    "sandbox_minimum": "none",
    "network": "unknown",
    "max_invocations": 1,
    "idle_timeout_seconds": null,
    "dirty_worktree": "fail",
    "filesystem_isolation": false,
    "network_isolation": false,
    "preserve_on_failure": true,
    "structured_output": false,
    "timeouts": {},
    "delivery_enabled": false,
    "delivery_remote": null,
    "delivery_branch": null
  },
  "required_evidence": [],
  "acceptance_commands": []
}
